{
  "id": "rel-costa-operates-in-morocco",
  "record_type": "relationship",
  "subject_id": "company-costa-group-holdings",
  "predicate": "operates_in",
  "object_id": "geography-morocco",
  "status": "active",
  "evidence_ids": [
    "ev-costa-african-blue-2023"
  ],
  "effective_date": null,
  "notes": "confidence=medium; African Blue operation."
}
