{
  "id": "rel-fall-creek-program-develops-sekoya-grande",
  "record_type": "relationship",
  "subject_id": "breeding_program-fall-creek-blueberry-breeding",
  "predicate": "develops",
  "object_id": "variety-sekoya-grande",
  "status": "active",
  "evidence_ids": [
    "ev-uspp031822-sekoya-grande"
  ],
  "effective_date": null,
  "notes": "confidence=high; Selection code prefix and assignee of record place this cultivar in the Fall Creek programme."
}
