{
  "id": "rel-mbg-owns-berry-blue",
  "record_type": "relationship",
  "subject_id": "company-michigan-blueberry-growers",
  "predicate": "owns",
  "object_id": "company-berry-blue-llc",
  "status": "disputed",
  "evidence_ids": [
    "ev-mbg-berry-blue-varieties",
    "ev-hortifrut-genetic-development"
  ],
  "effective_date": null,
  "notes": "confidence=low; Asserted by MBG and contradicted by Hortifrut's joint-venture description. Recorded as disputed pending an ownership instrument."
}
