{
  "id": "rel-uf-develops-farthing",
  "record_type": "relationship",
  "subject_id": "company-university-of-florida",
  "predicate": "develops",
  "object_id": "variety-farthing",
  "status": "active",
  "evidence_ids": [
    "ev-uf-ifas-hs1245",
    "ev-uf-breeding-farthing"
  ],
  "effective_date": null,
  "notes": "confidence=high; Released by the University of Florida IFAS blueberry breeding programme."
}
