{
  "id": "rel-bisa-trading-owns-uspp027142p3",
  "record_type": "relationship",
  "subject_id": "company-bisa-trading",
  "predicate": "owns",
  "object_id": "patent-uspp027142p3",
  "status": "active",
  "evidence_ids": [
    "ev-uspp027142-eb12-19"
  ],
  "effective_date": null,
  "notes": "confidence=high; Named as an assignee of record on the granted patent for 'EB 12-19'."
}
