{
  "id": "rel-united-exports-operates-in-united-states",
  "record_type": "relationship",
  "subject_id": "company-united-exports",
  "predicate": "operates_in",
  "object_id": "geography-united-states",
  "status": "active",
  "evidence_ids": [
    "ev-ozblu-migiva-2019"
  ],
  "effective_date": null,
  "notes": "confidence=medium; Announced joint venture farms at Venus and Sebring, Florida. Announced, not confirmed as planted."
}
