{
  "id": "rel-driscolls-develops-drisbluetwentyone",
  "record_type": "relationship",
  "subject_id": "company-driscolls",
  "predicate": "develops",
  "object_id": "variety-drisbluetwentyone",
  "status": "active",
  "evidence_ids": [
    "ev-uspp032267-drisbluetwentyone"
  ],
  "effective_date": null,
  "notes": "confidence=high; Named applicant or assignee on the registered right for this denomination."
}
